Command smartctl -a /dev/bus/0 -d megaraid,123 
smartctl 6.2 2013-07-26 r3841 [x86_64-linux-3.10.0-327.36.3.el7.x86_64] (local build)
Copyright (C) 2002-13, Bruce Allen, Christian Franke, www.smartmontools.org

/dev/bus/0 [megaraid_disk_123] [SAT]: Device open changed type from 'megaraid,123' to 'sat+megaraid,123'
=== START OF INFORMATION SECTION ===
Device Model:     SAMSUNG MZ7KM1T9HMJP-00005
Serial Number:    S3F6NX0J900136
LU WWN Device Id: 5 002538 c407bac03
Firmware Version: GXM5104Q
User Capacity:    1,920,383,410,176 bytes [1.92 TB]
Sector Size:      512 bytes logical/physical
Rotation Rate:    Solid State Device
Device is:        Not in smartctl database [for details use: -P showall]
ATA Version is:   ACS-2, ATA8-ACS T13/1699-D revision 4c
SATA Version is:  SATA 3.1, 6.0 Gb/s (current: 6.0 Gb/s)
Local Time is:    Sun Nov  7 14:28:54 2021 IRST
SMART support is: Available - device has SMART capability.
SMART support is: Enabled

=== START OF READ SMART DATA SECTION ===
SMART overall-health self-assessment test result: PASSED
Warning: This result is based on an Attribute check.

General SMART Values:
Offline data collection status:  (0x02)	Offline data collection activity
					was completed without error.
					Auto Offline Data Collection: Disabled.
Self-test execution status:      (   0)	The previous self-test routine completed
					without error or no self-test has ever 
					been run.
Total time to complete Offline 
data collection: 		( 6000) seconds.
Offline data collection
capabilities: 			 (0x53) SMART execute Offline immediate.
					Auto Offline data collection on/off support.
					Suspend Offline collection upon new
					command.
					No Offline surface scan supported.
					Self-test supported.
					No Conveyance Self-test supported.
					Selective Self-test supported.
SMART capabilities:            (0x0003)	Saves SMART data before entering
					power-saving mode.
					Supports SMART auto save timer.
Error logging capability:        (0x01)	Error logging supported.
					General Purpose Logging supported.
Short self-test routine 
recommended polling time: 	 (   2) minutes.
Extended self-test routine
recommended polling time: 	 ( 100) minutes.
SCT capabilities: 	       (0x003d)	SCT Status supported.
					SCT Error Recovery Control supported.
					SCT Feature Control supported.
					SCT Data Table supported.

SMART Attributes Data Structure revision number: 1
Vendor Specific SMART Attributes with Thresholds:
ID# ATTRIBUTE_NAME          FLAG     VALUE WORST THRESH TYPE      UPDATED  WHEN_FAILED RAW_VALUE
  5 Reallocated_Sector_Ct   0x0033   100   100   010    Pre-fail  Always       -       0
  9 Power_On_Hours          0x0032   097   097   000    Old_age   Always       -       12044
 12 Power_Cycle_Count       0x0032   099   099   000    Old_age   Always       -       90
177 Wear_Leveling_Count     0x0013   099   099   005    Pre-fail  Always       -       196
179 Used_Rsvd_Blk_Cnt_Tot   0x0013   100   100   010    Pre-fail  Always       -       0
180 Unused_Rsvd_Blk_Cnt_Tot 0x0013   100   100   010    Pre-fail  Always       -       10965
181 Program_Fail_Cnt_Total  0x0032   100   100   010    Old_age   Always       -       0
182 Erase_Fail_Count_Total  0x0032   100   100   010    Old_age   Always       -       0
183 Runtime_Bad_Block       0x0013   100   100   010    Pre-fail  Always       -       0
184 End-to-End_Error        0x0033   100   100   097    Pre-fail  Always       -       0
187 Reported_Uncorrect      0x0032   100   100   000    Old_age   Always       -       0
190 Airflow_Temperature_Cel 0x0032   070   034   000    Old_age   Always       -       30
194 Temperature_Celsius     0x0022   070   034   000    Old_age   Always       -       30 (Min/Max 16/66)
195 Hardware_ECC_Recovered  0x001a   200   200   000    Old_age   Always       -       0
197 Current_Pending_Sector  0x0032   100   100   000    Old_age   Always       -       0
199 UDMA_CRC_Error_Count    0x003e   100   100   000    Old_age   Always       -       0
202 Unknown_SSD_Attribute   0x0033   100   100   010    Pre-fail  Always       -       0
235 Unknown_Attribute       0x0012   099   099   000    Old_age   Always       -       67
241 Total_LBAs_Written      0x0032   099   099   000    Old_age   Always       -       348683357652
242 Total_LBAs_Read         0x0032   099   099   000    Old_age   Always       -       422522034318
243 Unknown_Attribute       0x0032   100   100   000    Old_age   Always       -       0
244 Unknown_Attribute       0x0032   100   100   000    Old_age   Always       -       0
245 Unknown_Attribute       0x0032   100   100   000    Old_age   Always       -       65535
246 Unknown_Attribute       0x0032   100   100   000    Old_age   Always       -       65535
247 Unknown_Attribute       0x0032   100   100   000    Old_age   Always       -       65535
251 Unknown_Attribute       0x0032   100   100   000    Old_age   Always       -       826916033536

SMART Error Log Version: 1
No Errors Logged

SMART Self-test log structure revision number 1
Num  Test_Description    Status                  Remaining  LifeTime(hours)  LBA_of_first_error
# 1  Extended offline    Completed without error       00%       299         -

SMART Selective self-test log data structure revision number 1
 SPAN  MIN_LBA  MAX_LBA  CURRENT_TEST_STATUS
    1        0        0  Not_testing
    2        0        0  Not_testing
    3        0        0  Not_testing
    4        0        0  Not_testing
    5        0        0  Not_testing
  255        0    65535  Read_scanning was completed without error
Selective self-test flags (0x0):
  After scanning selected spans, do NOT read-scan remainder of disk.
If Selective self-test is pending on power-up, resume after 0 minute delay.
