Command smartctl -a /dev/bus/0 -d megaraid,151
smartctl 6.2 2013-07-26 r3841 [x86_64-linux-3.10.0-327.36.3.el7.x86_64] (local build)
Copyright (C) 2002-13, Bruce Allen, Christian Franke, www.smartmontools.org

/dev/bus/0 [megaraid_disk_151] [SAT]: Device open changed type from 'megaraid,151' to 'sat+megaraid,151'
=== START OF INFORMATION SECTION ===
Device Model:     Micron_5100_MTFDDAK7T6TBY
Serial Number:    17491E9AF12A
LU WWN Device Id: 5 00a075 11e9af12a
Firmware Version: D0MU817
User Capacity:    7,681,501,126,656 bytes [7.68 TB]
Sector Sizes:     512 bytes logical, 16384 bytes physical
Rotation Rate:    Solid State Device
Device is:        Not in smartctl database [for details use: -P showall]
ATA Version is:   ACS-3 (unknown minor revision code: 0x006d)
SATA Version is:  SATA >3.1, 6.0 Gb/s (current: 6.0 Gb/s)
Local Time is:    Sun Nov  7 14:28:54 2021 IRST
SMART support is: Available - device has SMART capability.
SMART support is: Enabled

=== START OF READ SMART DATA SECTION ===
SMART overall-health self-assessment test result: PASSED
Warning: This result is based on an Attribute check.

General SMART Values:
Offline data collection status:  (0x04)	Offline data collection activity
was suspended by an interrupting command from host.
Auto Offline Data Collection: Disabled.
Self-test execution status:      (   0)	The previous self-test routine completed
without error or no self-test has ever
been run.
Total time to complete Offline
data collection: 		( 1686) seconds.
Offline data collection
capabilities: 			 (0x7b) SMART execute Offline immediate.
Auto Offline data collection on/off support.
Suspend Offline collection upon new
command.
Offline surface scan supported.
Self-test supported.
Conveyance Self-test supported.
Selective Self-test supported.
SMART capabilities:            (0x0003)	Saves SMART data before entering
power-saving mode.
Supports SMART auto save timer.
Error logging capability:        (0x01)	Error logging supported.
General Purpose Logging supported.
Short self-test routine
recommended polling time: 	 (   2) minutes.
Extended self-test routine
recommended polling time: 	 (  45) minutes.
Conveyance self-test routine
recommended polling time: 	 (   3) minutes.
SCT capabilities: 	       (0x0035)	SCT Status supported.
SCT Feature Control supported.
SCT Data Table supported.

SMART Attributes Data Structure revision number: 16
Vendor Specific SMART Attributes with Thresholds:
ID# ATTRIBUTE_NAME          FLAG     VALUE WORST THRESH TYPE      UPDATED  WHEN_FAILED RAW_VALUE
1 Raw_Read_Error_Rate     0x002f   100   100   050    Pre-fail  Always       -       0
5 Reallocated_Sector_Ct   0x0032   100   100   001    Old_age   Always       -       0
9 Power_On_Hours          0x0032   100   100   001    Old_age   Always       -       12681
12 Power_Cycle_Count       0x0032   100   100   001    Old_age   Always       -       24
170 Unknown_Attribute       0x0033   100   100   010    Pre-fail  Always       -       0
171 Unknown_Attribute       0x0032   100   100   000    Old_age   Always       -       0
172 Unknown_Attribute       0x0032   100   100   001    Old_age   Always       -       0
173 Unknown_Attribute       0x0032   100   100   000    Old_age   Always       -       13
174 Unknown_Attribute       0x0032   100   100   000    Old_age   Always       -       12
183 Runtime_Bad_Block       0x0032   100   100   000    Old_age   Always       -       0
184 End-to-End_Error        0x0032   100   100   000    Old_age   Always       -       0
187 Reported_Uncorrect      0x0032   100   100   000    Old_age   Always       -       0
188 Command_Timeout         0x0032   100   100   000    Old_age   Always       -       62
194 Temperature_Celsius     0x0022   072   038   000    Old_age   Always       -       28 (Min/Max 18/62)
195 Hardware_ECC_Recovered  0x0032   100   100   000    Old_age   Always       -       0
196 Reallocated_Event_Count 0x0032   100   100   000    Old_age   Always       -       0
197 Current_Pending_Sector  0x0032   100   100   000    Old_age   Always       -       0
198 Offline_Uncorrectable   0x0030   100   100   000    Old_age   Offline      -       0
199 UDMA_CRC_Error_Count    0x0032   100   100   000    Old_age   Always       -       0
202 Unknown_SSD_Attribute   0x0030   100   100   001    Old_age   Offline      -       0
206 Unknown_SSD_Attribute   0x000e   100   100   000    Old_age   Always       -       0
246 Unknown_Attribute       0x0032   100   100   000    Old_age   Always       -       72210263309
247 Unknown_Attribute       0x0032   100   100   000    Old_age   Always       -       4036608712
248 Unknown_Attribute       0x0032   100   100   000    Old_age   Always       -       4055116545
180 Unused_Rsvd_Blk_Cnt_Tot 0x0033   000   000   000    Pre-fail  Always       -       91518
210 Unknown_Attribute       0x0032   100   100   000    Old_age   Always       -       0

SMART Error Log Version: 1
No Errors Logged

SMART Self-test log structure revision number 1
Num  Test_Description    Status                  Remaining  LifeTime(hours)  LBA_of_first_error
# 1  Vendor (0xff)       Completed without error       00%     12654         -
# 2  Vendor (0xff)       Completed without error       00%     11811         -
# 3  Vendor (0xff)       Completed without error       00%     10091         -
# 4  Vendor (0xff)       Completed without error       00%      8526         -
# 5  Vendor (0xff)       Completed without error       00%      7875         -
# 6  Vendor (0xff)       Completed without error       00%      7359         -
# 7  Vendor (0xff)       Completed without error       00%      6848         -
# 8  Vendor (0xff)       Completed without error       00%      6323         -
# 9  Vendor (0xff)       Completed without error       00%      5718         -
#10  Vendor (0xff)       Completed without error       00%      5291         -
#11  Vendor (0xff)       Completed without error       00%      4928         -
#12  Vendor (0xff)       Completed without error       00%      4600         -
#13  Vendor (0xff)       Completed without error       00%      4181         -
#14  Vendor (0xff)       Completed without error       00%      3783         -
#15  Vendor (0xff)       Completed without error       00%      3251         -
#16  Vendor (0xff)       Completed without error       00%      3079         -
#17  Vendor (0xff)       Completed without error       00%      2888         -
#18  Vendor (0xff)       Completed without error       00%      2604         -
#19  Vendor (0xff)       Completed without error       00%      2506         -
#20  Vendor (0xff)       Completed without error       00%      1928         -
#21  Vendor (0xff)       Completed without error       00%       987         -

SMART Selective self-test log data structure revision number 1
SPAN  MIN_LBA  MAX_LBA  CURRENT_TEST_STATUS
1        0        0  Not_testing
2        0        0  Not_testing
3        0        0  Not_testing
4        0        0  Not_testing
5        0        0  Not_testing
Selective self-test flags (0x0):
After scanning selected spans, do NOT read-scan remainder of disk.
If Selective self-test is pending on power-up, resume after 0 minute delay.

-=-=-=-=-=-=-=-=-=-=-=-=-=-=-=-=-=-=-=
